{
  "schema_version": 1,
  "id": "H-finish-repeat",
  "branch_ids": [
    "B-finish-study",
    "B-finish-repetition"
  ],
  "question": "Does removing pair features improve novel-target ranking while harming aggregate ranking?",
  "rationale": "Operational questions chosen after inspecting previous development pilots; one bounded reproduction/extension batch, not new independent confirmation. The tolerance is chosen for this study, not a domain constant.",
  "estimand": {
    "metric": "ndcg@10",
    "weighting": "event",
    "primary_protocol": "P20",
    "sensitivity_protocol": "U20",
    "split": "development",
    "interval": "95% paired user-cluster bootstrap; conditional descriptive development uncertainty",
    "secondary_outputs": [
      "recall@10",
      "equal-user means",
      "all/repeat/novel query and user counts"
    ],
    "evidence_boundary": "Pilot-informed and development-only; already seen pilot and historical overnight outputs. No preregistration, blind confirmation, independent sample or final-test claim."
  },
  "comparison": {
    "left": "no_pair",
    "right": "original",
    "subgroups": [
      "novel",
      "all"
    ],
    "difference": "no_pair-minus-original",
    "feature_counts": [
      6,
      9
    ]
  },
  "decision_rule": {
    "supported": "novel ci_low > 0 AND all ci_high < 0, evaluated separately within each protocol",
    "unsupported": "novel ci_high < 0 OR all ci_low > 0 (a required sign contradicted at the stated precision)",
    "inconclusive": "otherwise, including uncertain signs; preserve equal-user and repeat-target diagnostics",
    "qualification": "This is the nine-feature original-model ablation, not a manual-model ablation."
  },
  "references": [
    "evidence/baseline/analysis.json",
    "evidence/cold-start-verification/analysis.json",
    "research/design.yaml",
    "research/decisions/D-finish-study-plan.json"
  ],
  "created_at": "2026-10-25T18:24:11.391655+00:00"
}
